Fingerprint_Enhancement_Jupyter_Project/Fingerprint_Enhancement_Jupyter_Project/Fingerprint_Enhancement_Project/outputs/final_large_real_outliers.csv

filename,index,noise_seed,degraded_psnr,enhanced_psnr,delta_psnr,degraded_mse,enhanced_mse,delta_mse,degraded_ssim,enhanced_ssim,delta_ssim,above_28_17,runtime_seconds,outlier_group,retained
100__M_Left_thumb_finger.BMP,4,20260907,27.025428446442916,28.417826467787087,1.392398021344171,0.001983613956844418,0.0014395188401700582,-0.0005440951166743597,0.9183081810625792,0.9495651641521454,0.03125698308956626,True,0.08789019999994707,lowest_10_enhanced_psnr,True
115__F_Right_thumb_finger.BMP,169,20261072,27.03774138478356,28.42830438520252,1.390563000418961,0.001977998060964654,0.0014360500005375254,-0.0005419480604271284,0.8935299827292561,0.9503650803455115,0.05683509761625538,True,0.08250459999999293,lowest_10_enhanced_psnr,True
124__M_Right_thumb_finger.BMP,269,20261172,27.042032917412783,28.465361613668332,1.423328696255549,0.001976044444034917,0.0014238486854846037,-0.0005521957585503134,0.9141064023610354,0.9510500344693661,0.03694363210833074,True,0.08137410000017553,lowest_10_enhanced_psnr,True
115__F_Left_thumb_finger.BMP,164,20261067,27.013736303828864,28.473329867405873,1.459593563577009,0.0019889614678411417,0.0014212386625071958,-0.0005677228053339459,0.8937097432590425,0.9480959823631048,0.05438623910406226,True,0.08265860000028624,lowest_10_enhanced_psnr,True
13__F_Right_thumb_finger.BMP,439,20261342,27.163656415587035,28.496818591801848,1.3331621762148131,0.0019214733193605015,0.0014135726728810483,-0.0005079006464794532,0.8880043315437436,0.9493577396759987,0.061353408132255094,True,0.08228550000012547,lowest_10_enhanced_psnr,True
104__M_Left_thumb_finger.BMP,44,20260947,27.197881445998743,28.510634733522053,1.3127532875233108,0.0019063904571996076,0.0014090828419765224,-0.0004973076152230852,0.8948993438842595,0.9401386968823672,0.04523935299810766,True,0.08096269999987271,lowest_10_enhanced_psnr,True
100__M_Right_thumb_finger.BMP,9,20260912,27.161751816638727,28.519912983645614,1.3581611670068874,0.001922316166506854,0.001406075696340351,-0.000516240470166503,0.892115608337462,0.9526561815886497,0.06054057325118778,True,0.08235490000015488,lowest_10_enhanced_psnr,True
115__F_Right_middle_finger.BMP,167,20261070,27.08820449927793,28.530511076989157,1.4423065777112285,0.001955147604051662,0.0014026486314028524,-0.0005524989726488096,0.8641413964313864,0.9255861660648584,0.06144476963347201,True,0.08213700000032986,lowest_10_enhanced_psnr,True
110__F_Right_index_finger.BMP,115,20261018,27.05088259183794,28.55657488139139,1.5056922895534512,0.0019720219326505063,0.0013942559671359213,-0.000577765965514585,0.8875640001668632,0.9396363996778726,0.05207239951100939,True,0.0812274999998408,lowest_10_enhanced_psnr,True
100__M_Right_middle_finger.BMP,7,20260910,27.0060556868607,28.572216534826083,1.5661608479653815,0.0019924821129826903,0.001389243413741668,-0.0006032386992410224,0.903213450398922,0.9261454088122845,0.022931958413362485,True,0.09215920000042388,lowest_10_enhanced_psnr,True
127__F_Left_index_finger.BMP,290,20261193,28.319145999367997,31.746031827579554,3.4268858282115566,0.0014726020477739293,0.0006689548661303979,-0.0008036471816435314,0.6710594350368977,0.947440254881382,0.27638081984448426,True,0.09539630000017496,highest_10_enhanced_psnr,True
134__M_Left_little_finger.BMP,371,20261274,27.288013212539465,31.409271117194038,4.121257904654573,0.0018672337076898694,0.000722891117299434,-0.0011443425903904353,0.724975106641531,0.9187328848748207,0.19375777823328977,True,0.08088319999978921,highest_10_enhanced_psnr,True
137__M_Right_ring_finger.BMP,408,20261311,27.46553438355202,31.349330219864783,3.883795836312764,0.0017924479845956348,0.0007329375599412078,-0.0010595104246544271,0.7436814484277368,0.9368483852701187,0.19316693684238195,True,0.08194670000011683,highest_10_enhanced_psnr,True
118__F_Right_ring_finger.BMP,198,20261101,27.399869618469506,31.337361871908488,3.9374922534389825,0.0018197554895008393,0.000734960185209514,-0.0010847953042913254,0.7459698609837592,0.9406138746395111,0.1946440136557519,True,0.08385180000004766,highest_10_enhanced_psnr,True
130__F_Right_ring_finger.BMP,338,20261241,27.324155633517524,31.274822798143358,3.950667164625834,0.0018517588829256872,0.000745620294381864,-0.001106138588543823,0.7962622161409557,0.9532624494313001,0.1570002332903444,True,0.08051590000013675,highest_10_enhanced_psnr,True
127__F_Left_little_finger.BMP,291,20261194,28.31323292955153,31.252966114754216,2.9397331852026873,0.0014746084120321312,0.0007493822265684997,-0.0007252261854636315,0.6317532118041217,0.82725852158463,0.19550530978050829,True,0.08930380000037985,highest_10_enhanced_psnr,True
138__M_Right_middle_finger.BMP,417,20261320,27.868086471267944,31.16772819615733,3.299641724889387,0.001633771639365919,0.0007642354522553889,-0.00086953618711053,0.7460712662625313,0.9437185012514592,0.1976472349889279,True,0.07981530000006387,highest_10_enhanced_psnr,True
127__F_Left_ring_finger.BMP,293,20261196,28.07372784917022,31.111540617255386,3.0378127680851676,0.001558214405688545,0.0007741871137678265,-0.0007840272919207186,0.6531561674475074,0.8529332498406171,0.19977708239310976,True,0.08431480000035663,highest_10_enhanced_psnr,True
120__M_Right_little_finger.BMP,226,20261129,27.502436120926475,31.082568532961588,3.5801324120351126,0.001777282186018894,0.0007793690346348733,-0.0009979131513840206,0.7030821603148878,0.9028614682686329,0.1997793079537451,True,0.08109869999998409,highest_10_enhanced_psnr,True
130__F_Right_little_finger.BMP,336,20261239,27.477050614790627,31.066214565434272,3.589163950643645,0.0017877012282169205,0.0007823093906767399,-0.0010053918375401804,0.782272895248115,0.9385490837390423,0.15627618849092728,True,0.08175749999963955,highest_10_enhanced_psnr,True
136__F_Right_thumb_finger.BMP,399,20261302,27.789473794914134,29.040156561913584,1.25068276699945,0.00166361420697795,0.0012473385472359887,-0.0004162756597419614,0.703886962396115,0.6953224179074764,-0.008564544488638637,True,0.08177310000019133,smallest_10_delta_psnr,True
104__M_Left_thumb_finger.BMP,44,20260947,27.197881445998743,28.510634733522053,1.3127532875233108,0.0019063904571996076,0.0014090828419765224,-0.0004973076152230852,0.8948993438842595,0.9401386968823672,0.04523935299810766,True,0.08096269999987271,smallest_10_delta_psnr,True
13__F_Right_thumb_finger.BMP,439,20261342,27.163656415587035,28.496818591801848,1.3331621762148131,0.0019214733193605015,0.0014135726728810483,-0.0005079006464794532,0.8880043315437436,0.9493577396759987,0.061353408132255094,True,0.08228550000012547,smallest_10_delta_psnr,True
100__M_Right_thumb_finger.BMP,9,20260912,27.161751816638727,28.519912983645614,1.3581611670068874,0.001922316166506854,0.001406075696340351,-0.000516240470166503,0.892115608337462,0.9526561815886497,0.06054057325118778,True,0.08235490000015488,smallest_10_delta_psnr,True
115__F_Right_thumb_finger.BMP,169,20261072,27.03774138478356,28.42830438520252,1.390563000418961,0.001977998060964654,0.0014360500005375254,-0.0005419480604271284,0.8935299827292561,0.9503650803455115,0.05683509761625538,True,0.08250459999999293,smallest_10_delta_psnr,True
100__M_Left_thumb_finger.BMP,4,20260907,27.025428446442916,28.417826467787087,1.392398021344171,0.001983613956844418,0.0014395188401700582,-0.0005440951166743597,0.9183081810625792,0.9495651641521454,0.03125698308956626,True,0.08789019999994707,smallest_10_delta_psnr,True
124__M_Right_thumb_finger.BMP,269,20261172,27.042032917412783,28.465361613668332,1.423328696255549,0.001976044444034917,0.0014238486854846037,-0.0005521957585503134,0.9141064023610354,0.9510500344693661,0.03694363210833074,True,0.08137410000017553,smallest_10_delta_psnr,True
105__M_Left_thumb_finger.BMP,54,20260957,27.260543348794904,28.702014357966803,1.4414710091718987,0.0018790817088992838,0.0013483373475760717,-0.0005307443613232121,0.8766202702115774,0.9372556384615898,0.06063536825001237,True,0.08268920000000435,smallest_10_delta_psnr,True
115__F_Right_middle_finger.BMP,167,20261070,27.08820449927793,28.530511076989157,1.4423065777112285,0.001955147604051662,0.0014026486314028524,-0.0005524989726488096,0.8641413964313864,0.9255861660648584,0.06144476963347201,True,0.08213700000032986,smallest_10_delta_psnr,True
112__M_Right_little_finger.BMP,136,20261039,27.270010458712967,28.726295870815143,1.4562854121021758,0.0018749899926967261,0.0013408197948175339,-0.0005341701978791922,0.8502818296902179,0.9296694060001374,0.07938757630991944,True,0.081566699999712,smallest_10_delta_psnr,True
134__M_Left_little_finger.BMP,371,20261274,27.288013212539465,31.409271117194038,4.121257904654573,0.0018672337076898694,0.000722891117299434,-0.0011443425903904353,0.724975106641531,0.9187328848748207,0.19375777823328977,True,0.08088319999978921,largest_10_delta_psnr,True
130__F_Right_ring_finger.BMP,338,20261241,27.324155633517524,31.274822798143358,3.950667164625834,0.0018517588829256872,0.000745620294381864,-0.001106138588543823,0.7962622161409557,0.9532624494313001,0.1570002332903444,True,0.08051590000013675,largest_10_delta_psnr,True
118__F_Right_ring_finger.BMP,198,20261101,27.399869618469506,31.337361871908488,3.9374922534389825,0.0018197554895008393,0.000734960185209514,-0.0010847953042913254,0.7459698609837592,0.9406138746395111,0.1946440136557519,True,0.08385180000004766,largest_10_delta_psnr,True
137__M_Right_ring_finger.BMP,408,20261311,27.46553438355202,31.349330219864783,3.883795836312764,0.0017924479845956348,0.0007329375599412078,-0.0010595104246544271,0.7436814484277368,0.9368483852701187,0.19316693684238195,True,0.08194670000011683,largest_10_delta_psnr,True
130__F_Left_middle_finger.BMP,332,20261235,26.9347474326945,30.804766734949283,3.870019302254782,0.0020254673960184585,0.0008308513435783787,-0.0011946160524400797,0.7840536545504928,0.8996433346488476,0.1155896800983548,True,0.08202720000008412,largest_10_delta_psnr,True
129__M_Left_little_finger.BMP,311,20261214,27.04069614490138,30.87868807522309,3.83799193032171,0.001976652770546169,0.0008168290833283842,-0.001159823687217785,0.7985678869086504,0.9221481375255585,0.12358025061690803,True,0.08156320000034611,largest_10_delta_psnr,True
130__F_Left_index_finger.BMP,330,20261233,27.01617382033522,30.74529703509263,3.7291232147574114,0.0019878454586957956,0.0008423067800159546,-0.0011455386786798408,0.8371488888408541,0.9410371381390095,0.10388824929815532,True,0.08300099999996746,largest_10_delta_psnr,True
137__M_Right_middle_finger.BMP,407,20261310,27.30459076894507,31.023333261931008,3.718742492985939,0.0018601198320711584,0.0007900720055500667,-0.0010700478265210918,0.7501878668120503,0.9234540703024864,0.1732662034904361,True,0.08086800000000949,largest_10_delta_psnr,True
131__M_Left_index_finger.BMP,340,20261243,27.219819429222945,30.84241717832441,3.622597749101466,0.0018967847840096444,0.0008236795472440189,-0.0010731052367656255,0.7905833719850779,0.9336256241143942,0.14304225212931632,True,0.08184459999984028,largest_10_delta_psnr,True
120__M_Right_ring_finger.BMP,228,20261131,27.380389079373625,30.988485988209607,3.608096908835982,0.0018279364461073367,0.0007964369511760205,-0.0010314994949313162,0.7439823100515008,0.9196748909493685,0.17569258089786766,True,0.08057209999969928,largest_10_delta_psnr,True

Fingerprint_Enhancement_Jupyter_Project/Fingerprint_Enhancement_Jupyter_Project/Fingerprint_Enhancement_Project/outputs/final_large_validation_report.md

### X. What were the worst controlled cases?

100__M_Left_thumb_finger.BMP (28.418 dB), 115__F_Right_thumb_finger.BMP (28.428 dB), 124__M_Right_thumb_finger.BMP (28.465 dB), 115__F_Left_thumb_finger.BMP (28.473 dB), 13__F_Right_thumb_finger.BMP (28.497 dB), 104__M_Left_thumb_finger.BMP (28.511 dB), 100__M_Right_thumb_finger.BMP (28.520 dB), 115__F_Right_middle_finger.BMP (28.531 dB), 110__F_Right_index_finger.BMP (28.557 dB), 100__M_Right_middle_finger.BMP (28.572 dB)